{
  "id": "snu",
  "name": "서울대학교",
  "category": "인서울 주요대",
  "region": { "value": "서울 관악구", "status": "confirmed" },
  "campus": "관악",
  "summary": { "susiRatio": 65.7, "jeongsiRatio": 34.3, "hasSuneungMinimum": false, "hasInterview": true, "totalQuota": null },
  "highlights": [
    "정시 수능위주 지역균형전형 폐지, 수시 학종 지역균형 인원 확대",
    "정시 전형에 교과역량평가 40% 신설(고교 연계 강화)",
    "전 전형 수능최저 미적용"
  ],
  "admissionTypes": [
    {
      "track": "학생부종합", "subType": "지역균형",
      "quota": { "value": "확인 필요", "source": { "name": "서울대 입학본부 2028 주요사항", "url": "https://admission.snu.ac.kr/undergraduate/notice" }, "asOf": "2025-09-29", "status": "needs_review" },
      "method": { "value": "1단계 서류 100%(3배수) → 2단계 1단계 70 + 면접 30. 자사고·외고·국제고·과학고·영재학교 지원 불가, 고교별 추천 3명", "status": "confirmed" },
      "suneungMinimum": { "value": "미적용", "status": "confirmed" },
      "interview": { "value": true, "status": "confirmed" }
    },
    {
      "track": "학생부종합", "subType": "일반전형",
      "quota": { "value": "약 2,313명(언론 수치)", "status": "needs_review" },
      "method": { "value": "1단계 서류 100%(2배수) → 2단계 1단계 50 + 면접 50", "status": "confirmed" },
      "suneungMinimum": { "value": "미적용", "status": "confirmed" },
      "interview": { "value": true, "status": "confirmed" }
    },
    {
      "track": "학생부종합", "subType": "기회균형(사회통합)",
      "quota": { "value": "확인 필요", "status": "needs_review" },
      "method": { "value": "1단계 서류 100%(2배수) → 2단계 1단계 70 + 면접 30", "status": "confirmed" },
      "suneungMinimum": { "value": "미적용", "status": "confirmed" },
      "interview": { "value": true, "status": "confirmed" }
    },
    {
      "track": "정시(수능)", "subType": "일반전형",
      "quota": { "value": "1,307명 (2027 대비 −242명, 34.3%)", "status": "confirmed" },
      "method": { "value": "1단계 수능 등급 100%로 3배수 → 2단계 수능 60 + 교과역량평가 40. 의·수의대는 수능 60 + 교과 20 + 적성·인성면접 20", "status": "confirmed" },
      "suneungMinimum": { "value": "해당 없음(정시)", "status": "confirmed" },
      "interview": { "value": false, "status": "confirmed" }
    }
  ],
  "departments": [
    { "name": "의예과", "college": "의과대학", "track": "학생부종합·정시", "suneungMinimum": { "value": "없음(전 모집단위 미적용)", "status": "confirmed" } },
    { "name": "치의학과", "college": "치의학대학원", "track": "학생부종합·정시", "quota": 45, "suneungMinimum": { "value": "없음", "status": "confirmed" } },
    { "name": "수의예과", "college": "수의과대학", "track": "학생부종합·정시", "quota": 40, "suneungMinimum": { "value": "없음", "status": "confirmed" } },
    { "name": "약학계열", "college": "약학대학", "track": "학생부종합·정시", "quota": 63, "suneungMinimum": { "value": "없음", "status": "confirmed" } },
    { "name": "간호대학", "college": "간호대학", "track": "학생부종합·정시", "quota": 64, "suneungMinimum": { "value": "없음", "status": "confirmed" } },
    { "name": "경영대학", "college": "경영대학", "track": "학생부종합·정시", "quota": 133, "suneungMinimum": { "value": "없음", "status": "confirmed" } },
    { "name": "컴퓨터공학부", "college": "공과대학", "track": "학생부종합·정시", "quota": 84, "suneungMinimum": { "value": "없음", "status": "confirmed" } }
  ],
  "naesinReflection": { "value": "전 전형 서류 정성평가 중심. 정시에 교과역량평가 40%를 신설해 고교 교육과정 연계를 강화. 수시(지역균형·일반)·정시 전 모집단위 수능최저 미적용.", "status": "confirmed" },
  "changes2028": [
    { "value": "정시 수능위주 지역균형전형 폐지, 수시 학종 지역균형 확대", "status": "confirmed" },
    { "value": "정시에 교과역량평가 40% 신설", "status": "confirmed" },
    { "value": "지역균형 고교별 추천 2→3명, 수능최저 폐지", "status": "confirmed" }
  ],
  "officialLinks": [
    { "name": "서울대학교 입학본부(공지)", "url": "https://admission.snu.ac.kr/undergraduate/notice" }
  ]
}
