{
  "id": "cnu",
  "name": "충남대학교",
  "category": "지방거점국립대",
  "region": { "value": "대전 유성구", "status": "confirmed" },
  "campus": "대덕(+보운)",
  "summary": { "susiRatio": 82.0, "jeongsiRatio": 18.0, "hasSuneungMinimum": null, "hasInterview": true, "totalQuota": 4170 },
  "highlights": [
    "학생부종합 2,034명(48.8%)으로 가장 큰 비중",
    "정시 수능 752명(18.0%)",
    "의예·수의예·약학 학생부교과에 정성평가 도입"
  ],
  "admissionTypes": [
    {
      "track": "학생부교과", "subType": "일반 / 지역인재",
      "quota": { "value": "교과·수능 합 1,139명(27.3%)", "source": { "name": "충남대 2028 시행계획(어디가 공식 모음집)", "url": "https://www.adiga.kr/uct/ces/archiveView.do?menuId=PCUCTCES1000&prtlBbsId=24811" }, "asOf": "2026-04-30", "status": "confirmed" },
      "method": { "value": "교과 위주. 의예·수의예·약학은 학생부 정성평가 반영(변경)", "status": "confirmed" },
      "suneungMinimum": { "value": "전형·모집단위별 상이(확인 필요)", "status": "needs_review" },
      "interview": { "value": false, "status": "needs_review" }
    },
    {
      "track": "학생부종합", "subType": "Ⅰ/Ⅱ/Ⅲ · 지역인재 · 지역의사선발 · 영농창업",
      "quota": { "value": "2,034명(48.8%)", "status": "confirmed" },
      "method": { "value": "서류·면접(전형별 상이)", "status": "confirmed" },
      "suneungMinimum": { "value": "확인 필요", "status": "needs_review" },
      "interview": { "value": true, "status": "confirmed" }
    },
    {
      "track": "정시(수능)", "subType": "가·나군",
      "quota": { "value": "752명(18.0%)", "status": "confirmed" },
      "method": { "value": "수능 위주", "status": "confirmed" },
      "suneungMinimum": { "value": "해당 없음(정시)", "status": "confirmed" },
      "interview": { "value": false, "status": "confirmed" }
    }
  ],
  "naesinReflection": { "value": "의예·수의예·약학 학생부교과에 정성평가 도입.", "status": "confirmed" },
  "changes2028": [
    { "value": "의예·수의예·약학 학생부교과 정성평가 도입", "status": "confirmed" },
    { "value": "통합형 수능·5등급제 반영", "status": "confirmed" }
  ],
  "officialLinks": [
    { "name": "충남대학교 입학처", "url": "https://ipsi.cnu.ac.kr/" },
    { "name": "어디가 2028 시행계획 모음집", "url": "https://www.adiga.kr/uct/ces/archiveView.do?menuId=PCUCTCES1000&prtlBbsId=24811" }
  ]
}
