{
  "id": "hanyang",
  "name": "한양대학교",
  "category": "인서울 주요대",
  "region": {
    "value": "서울 성동구",
    "status": "confirmed"
  },
  "campus": "서울(행당)",
  "summary": {
    "susiRatio": 66.8,
    "jeongsiRatio": 33.2,
    "hasSuneungMinimum": true,
    "hasInterview": true,
    "totalQuota": null
  },
  "highlights": [
    "추천형 교과 60 + 학생부종합평가 40으로 대폭 변경, 추천인원 제한 폐지",
    "학종 학업형(서류형 폐지·통합)에 수능최저 신설",
    "정시에도 학생부종합평가 10% 신설(정성평가 전방위 강화)"
  ],
  "admissionTypes": [
    {
      "track": "학생부교과",
      "subType": "추천형",
      "quota": {
        "value": "506명",
        "source": {
          "name": "2028 한양대 신입학 전형계획(공식 PDF, 4.30)",
          "url": "https://go.hanyang.ac.kr/"
        },
        "asOf": "2026-04-30",
        "status": "confirmed"
      },
      "method": {
        "value": "교과 60 + 학생부종합평가 40 (2027 교과90+정성10에서 변경). 학교장 추천인원 제한 폐지",
        "status": "confirmed"
      },
      "suneungMinimum": {
        "value": "자연·상경·인터칼리지 3개 영역(수학 포함) 각 3등급 / 인문 3개 각 3등급",
        "status": "confirmed"
      },
      "interview": {
        "value": false,
        "status": "confirmed"
      }
    },
    {
      "track": "학생부종합",
      "subType": "학업형(서류형 폐지·통합)",
      "quota": {
        "value": "811명",
        "status": "confirmed"
      },
      "method": {
        "value": "학생부종합평가 100%, 일괄",
        "status": "confirmed"
      },
      "suneungMinimum": {
        "value": "신설 — 자연·상경 3개 영역(수학 포함) 합 7 / 인문 3개 합 7 / 의예 4개 합 4",
        "status": "confirmed"
      },
      "interview": {
        "value": false,
        "status": "confirmed"
      }
    },
    {
      "track": "학생부종합",
      "subType": "면접형",
      "quota": {
        "value": "모집단위 대폭 확대",
        "status": "confirmed"
      },
      "method": {
        "value": "1단계 서류 100%(3~5배수) → 2단계 1단계 70 + 면접 30(제시문/학생부 기반)",
        "status": "confirmed"
      },
      "suneungMinimum": {
        "value": "미적용(수능 면제)",
        "source": {
          "name": "한양대 2028학년도 신입학 전형계획(서울캠, 2026-04-30)",
          "url": "https://site.hanyang.ac.kr/web/admission"
        },
        "status": "confirmed"
      },
      "interview": {
        "value": true,
        "status": "confirmed"
      }
    },
    {
      "track": "논술",
      "subType": "논술전형",
      "quota": {
        "value": "289명",
        "status": "confirmed"
      },
      "method": {
        "value": "논술 90 + 학생부(출결) 10 (2027 논술100에서 변경)",
        "status": "confirmed"
      },
      "suneungMinimum": {
        "value": "적용: 전 모집단위(의예 제외) 국·수·영·탐(상위1) 중 3개 영역 등급합 7 이내 / 의예과 3개 합 4(탐구 2과목 평균). 국·수·영·사·과·한국사 필수 응시",
        "source": {
          "name": "한양대 2028학년도 신입학 전형계획(서울캠, 2026-04-30)",
          "url": "https://site.hanyang.ac.kr/web/admission"
        },
        "status": "confirmed"
      },
      "interview": {
        "value": false,
        "status": "confirmed"
      }
    },
    {
      "track": "정시(수능)",
      "subType": "가군 일반",
      "quota": {
        "value": "가군 473·나군 444·다군 21 등",
        "status": "confirmed"
      },
      "method": {
        "value": "수능 90 + 학생부종합평가 10 (정시에 정성평가 도입). 한국사 전 계열 필수·감점",
        "status": "confirmed"
      },
      "suneungMinimum": {
        "value": "해당 없음(정시)",
        "status": "confirmed"
      },
      "interview": {
        "value": false,
        "status": "confirmed"
      }
    }
  ],
  "departments": [
    {
      "name": "의예과",
      "college": "의과대학",
      "track": "학업형·면접형·논술·정시",
      "quota": 66,
      "suneungMinimum": {
        "value": "3개 영역 등급합 4 이내(탐구 2과목 평균)",
        "status": "confirmed"
      }
    },
    {
      "name": "간호학과",
      "college": "간호대학",
      "track": "추천·학업형·논술·정시",
      "quota": 27,
      "suneungMinimum": {
        "value": "학업형 3개 영역 합 7(인문/자연별)",
        "status": "confirmed"
      }
    },
    {
      "name": "컴퓨터소프트웨어학부",
      "college": "공과대학",
      "track": "추천·학업형·면접형·논술·정시",
      "quota": 86,
      "suneungMinimum": {
        "value": "추천 수학포함 3개 각 3등급 / 학업형 3개 합 7",
        "status": "confirmed"
      }
    },
    {
      "name": "경영학부",
      "college": "경영대학",
      "track": "추천·학업형·면접형·논술·정시",
      "quota": 129,
      "suneungMinimum": {
        "value": "추천 3개 각 3등급 / 학업형 3개 합 7",
        "status": "confirmed"
      }
    }
  ],
  "naesinReflection": {
    "value": "교과·정시에 학생부종합평가(정성)를 확대 반영. 정량평가·종합평가 산출방법을 별도 규정. 의예과는 교과추천 미선발. 약·수의·치의 미보유.",
    "status": "confirmed"
  },
  "changes2028": [
    {
      "value": "추천형 교과 60 + 종합 40, 추천인원 제한 폐지",
      "status": "confirmed"
    },
    {
      "value": "학종 서류형 폐지 → 학업형으로 통합, 수능최저 신설",
      "status": "confirmed"
    },
    {
      "value": "면접형 모집단위 확대",
      "status": "confirmed"
    },
    {
      "value": "논술 출결 10% 반영, 정시 학생부종합평가 10% 신설",
      "status": "confirmed"
    }
  ],
  "officialLinks": [
    {
      "name": "한양대학교 입학처(서울)",
      "url": "https://go.hanyang.ac.kr/"
    }
  ]
}
