{
  "id": "inha",
  "name": "인하대학교",
  "category": "수도권 주요대",
  "region": {
    "value": "인천 미추홀구",
    "status": "confirmed"
  },
  "campus": "단일",
  "summary": {
    "susiRatio": null,
    "jeongsiRatio": null,
    "hasSuneungMinimum": true,
    "hasInterview": true,
    "totalQuota": 3960
  },
  "highlights": [
    "지역의사선발(의예 7명)·서해5도 의학계열 신설",
    "학종 서류형 +195명 확대, 교과 자연계 수능최저 완화",
    "논술 논·서술형 전환 + 수능최저 신설, 정시 탐구 가산점 폐지"
  ],
  "admissionTypes": [
    {
      "track": "학생부종합",
      "subType": "인하미래인재 — 면접형",
      "quota": {
        "value": "740명(인하미래인재 면접형)",
        "source": {
          "name": "인하대 2028학년도 대학입학전형 시행계획(입학처, 2026-04-30)",
          "url": "https://admission.inha.ac.kr/cms/FR_BBS_CON/BoardView.do?MENU_ID=240&BBS_SEQ=1300"
        },
        "status": "confirmed"
      },
      "method": {
        "value": "1단계 서류 100%(3.5배수) → 2단계 서류 70 + 면접 30",
        "source": {
          "name": "교육을비추다",
          "url": "https://www.kyobit.com/news/articleView.html?idxno=4873"
        },
        "status": "confirmed"
      },
      "suneungMinimum": {
        "value": "미적용(의예과 제외)",
        "status": "confirmed"
      },
      "interview": {
        "value": true,
        "status": "confirmed"
      }
    },
    {
      "track": "학생부종합",
      "subType": "인하미래인재 — 서류형",
      "quota": {
        "value": "447명(인하미래인재 서류형 — 2027 대비 +195 확대)",
        "source": {
          "name": "인하대 2028학년도 대학입학전형 시행계획(입학처, 2026-04-30)",
          "url": "https://admission.inha.ac.kr/cms/FR_BBS_CON/BoardView.do?MENU_ID=240&BBS_SEQ=1300"
        },
        "status": "confirmed"
      },
      "method": {
        "value": "서류종합평가 100% (전 교과 정성평가)",
        "status": "confirmed"
      },
      "suneungMinimum": {
        "value": "미적용",
        "status": "confirmed"
      },
      "interview": {
        "value": false,
        "status": "confirmed"
      }
    },
    {
      "track": "학생부교과",
      "subType": "지역균형",
      "quota": {
        "value": "485명(지역균형)",
        "source": {
          "name": "인하대 2028학년도 대학입학전형 시행계획(입학처, 2026-04-30)",
          "url": "https://admission.inha.ac.kr/cms/FR_BBS_CON/BoardView.do?MENU_ID=240&BBS_SEQ=1300"
        },
        "status": "confirmed"
      },
      "method": {
        "value": "교과 90 + 비교과(출결·봉사) 10",
        "status": "confirmed"
      },
      "suneungMinimum": {
        "value": "자연계 완화 — 국·수·영·탐 중 2개 영역 합 6 이내(자연=인문 동일화), N수생 허용",
        "status": "confirmed"
      },
      "interview": {
        "value": false,
        "status": "confirmed"
      }
    },
    {
      "track": "학생부종합",
      "subType": "지역의사선발(신설)",
      "quota": {
        "value": "의예과 7명",
        "status": "confirmed"
      },
      "method": {
        "value": "면접형과 동일 방식",
        "status": "confirmed"
      },
      "suneungMinimum": {
        "value": "3개 영역 합 5 이내",
        "status": "confirmed"
      },
      "interview": {
        "value": true,
        "status": "confirmed"
      }
    },
    {
      "track": "논술",
      "subType": "논술우수자",
      "quota": {
        "value": "449명(논술우수자)",
        "source": {
          "name": "인하대 2028학년도 대학입학전형 시행계획(입학처, 2026-04-30)",
          "url": "https://admission.inha.ac.kr/cms/FR_BBS_CON/BoardView.do?MENU_ID=240&BBS_SEQ=1300"
        },
        "status": "confirmed"
      },
      "method": {
        "value": "논술 90 + 교과 10 (논·서술형으로 출제 변경)",
        "status": "confirmed"
      },
      "suneungMinimum": {
        "value": "신설 — 3개 영역 합 6 이내(의예과 제외)",
        "status": "confirmed"
      },
      "interview": {
        "value": false,
        "status": "confirmed"
      }
    },
    {
      "track": "정시(수능)",
      "subType": "일반",
      "quota": {
        "value": "1,210명(정원내 가 412·나 519·다 279)",
        "source": {
          "name": "인하대 2028학년도 대학입학전형 시행계획(입학처, 2026-04-30)",
          "url": "https://admission.inha.ac.kr/cms/FR_BBS_CON/BoardView.do?MENU_ID=240&BBS_SEQ=1300"
        },
        "status": "confirmed"
      },
      "method": {
        "value": "수능 100%, 탐구 영역 가산점 폐지",
        "status": "confirmed"
      },
      "suneungMinimum": {
        "value": "해당 없음(정시)",
        "status": "confirmed"
      },
      "interview": {
        "value": false,
        "status": "confirmed"
      }
    }
  ],
  "naesinReflection": {
    "value": "지역균형은 교과 90 + 비교과 10, 학종 서류형은 전 교과 정성평가.",
    "status": "confirmed"
  },
  "changes2028": [
    {
      "value": "지역의사선발(의예 7명)·서해5도 의학계열 신설",
      "status": "confirmed"
    },
    {
      "value": "학종 서류형 +195명 확대",
      "status": "confirmed"
    },
    {
      "value": "교과 자연계 수능최저 완화(인문=자연 동일화)",
      "status": "confirmed"
    },
    {
      "value": "논술 논·서술형 전환 + 수능최저 신설, 정시 탐구 가산점 폐지",
      "status": "confirmed"
    }
  ],
  "officialLinks": [
    {
      "name": "인하대학교 입학처",
      "url": "https://admission.inha.ac.kr"
    }
  ]
}
