{
  "id": "hanyang-erica",
  "name": "한양대학교 ERICA",
  "category": "지방캠퍼스",
  "region": {
    "value": "경기 안산시 상록구",
    "status": "confirmed"
  },
  "campus": "ERICA(안산)",
  "summary": {
    "susiRatio": null,
    "jeongsiRatio": null,
    "hasSuneungMinimum": true,
    "hasInterview": true,
    "totalQuota": null
  },
  "highlights": [
    "서울캠퍼스와 별도 — 수치 혼용 금지",
    "논술전형 203명 신설(논술 100%, 수능최저 2개 합 6)",
    "학종 면접형 60→102명 확대, 교과 지역균형 531→380명 축소, 정시 다군 신설(94명)"
  ],
  "admissionTypes": [
    {
      "track": "학생부종합",
      "subType": "서류형",
      "quota": {
        "value": "428명(정원 내)",
        "source": {
          "name": "한양대 ERICA 2028학년도 신입학 전형계획 주요사항(입학처, 2026-04-30)",
          "url": "http://goerica.hanyang.ac.kr/upload/BBS0004/20260430094412DRG9V3.PDF"
        },
        "asOf": "2026-04",
        "status": "confirmed"
      },
      "method": {
        "value": "일괄합산 학생부종합 100% — 학업·진로·공동체 역량 정성평가(교과 정량 미산출)",
        "source": {
          "name": "한양대 ERICA 2028학년도 신입학 전형계획 주요사항(입학처, 2026-04-30)",
          "url": "http://goerica.hanyang.ac.kr/upload/BBS0004/20260430094412DRG9V3.PDF"
        },
        "status": "confirmed"
      },
      "suneungMinimum": {
        "value": "적용: 국·수·영·탐(상위 1과목) 중 2개 영역 등급 합 7 이내(약학 3개 합 6, 디자인계열 미적용)",
        "source": {
          "name": "한양대 ERICA 2028학년도 신입학 전형계획 주요사항(입학처, 2026-04-30)",
          "url": "http://goerica.hanyang.ac.kr/upload/BBS0004/20260430094412DRG9V3.PDF"
        },
        "status": "confirmed"
      },
      "interview": {
        "value": false,
        "source": {
          "name": "한양대 ERICA 2028학년도 신입학 전형계획 주요사항(입학처, 2026-04-30)",
          "url": "http://goerica.hanyang.ac.kr/upload/BBS0004/20260430094412DRG9V3.PDF"
        },
        "status": "confirmed"
      }
    },
    {
      "track": "학생부종합",
      "subType": "면접형",
      "quota": {
        "value": "102명(정원 내, 60명에서 확대)",
        "source": {
          "name": "한양대 ERICA 2028학년도 신입학 전형계획 주요사항(입학처, 2026-04-30)",
          "url": "http://goerica.hanyang.ac.kr/upload/BBS0004/20260430094412DRG9V3.PDF"
        },
        "status": "confirmed"
      },
      "method": {
        "value": "1단계 학생부종합 100%(3배수) → 2단계 1단계 70% + 면접 30%",
        "source": {
          "name": "한양대 ERICA 2028학년도 신입학 전형계획 주요사항(입학처, 2026-04-30)",
          "url": "http://goerica.hanyang.ac.kr/upload/BBS0004/20260430094412DRG9V3.PDF"
        },
        "status": "confirmed"
      },
      "suneungMinimum": {
        "value": "미적용",
        "source": {
          "name": "한양대 ERICA 2028학년도 신입학 전형계획 주요사항(입학처, 2026-04-30)",
          "url": "http://goerica.hanyang.ac.kr/upload/BBS0004/20260430094412DRG9V3.PDF"
        },
        "status": "confirmed"
      },
      "interview": {
        "value": true,
        "source": {
          "name": "한양대 ERICA 2028학년도 신입학 전형계획 주요사항(입학처, 2026-04-30)",
          "url": "http://goerica.hanyang.ac.kr/upload/BBS0004/20260430094412DRG9V3.PDF"
        },
        "status": "confirmed"
      }
    },
    {
      "track": "논술",
      "subType": "논술(신설)",
      "quota": {
        "value": "203명(정원 내, 신설)",
        "source": {
          "name": "한양대 ERICA 2028학년도 신입학 전형계획 주요사항(입학처, 2026-04-30)",
          "url": "http://goerica.hanyang.ac.kr/upload/BBS0004/20260430094412DRG9V3.PDF"
        },
        "status": "confirmed"
      },
      "method": {
        "value": "일괄합산 논술 100%(전 모집단위) — 출제유형·일정은 수시 모집요강에서 안내",
        "source": {
          "name": "한양대 ERICA 2028학년도 신입학 전형계획 주요사항(입학처, 2026-04-30)",
          "url": "http://goerica.hanyang.ac.kr/upload/BBS0004/20260430094412DRG9V3.PDF"
        },
        "status": "confirmed"
      },
      "suneungMinimum": {
        "value": "적용: 국·수·영·탐(상위 1과목) 중 2개 영역 등급 합 6 이내",
        "source": {
          "name": "한양대 ERICA 2028학년도 신입학 전형계획 주요사항(입학처, 2026-04-30)",
          "url": "http://goerica.hanyang.ac.kr/upload/BBS0004/20260430094412DRG9V3.PDF"
        },
        "status": "confirmed"
      },
      "interview": {
        "value": false,
        "source": {
          "name": "한양대 ERICA 2028학년도 신입학 전형계획 주요사항(입학처, 2026-04-30)",
          "url": "http://goerica.hanyang.ac.kr/upload/BBS0004/20260430094412DRG9V3.PDF"
        },
        "status": "confirmed"
      }
    }
  ],
  "naesinReflection": {
    "value": "교과(지역균형선발): 학생부교과 100% 정량평가 / 종합: 교과 정량 미산출, 전공관련 교과 위주 정성평가(3학년 1학기까지 반영)",
    "source": {
      "name": "한양대 ERICA 2028학년도 신입학 전형계획 주요사항(입학처, 2026-04-30)",
      "url": "http://goerica.hanyang.ac.kr/upload/BBS0004/20260430094412DRG9V3.PDF"
    },
    "status": "confirmed"
  },
  "changes2028": [
    {
      "value": "논술전형 203명 신설",
      "source": {
        "name": "한양대 ERICA 2028학년도 신입학 전형계획 주요사항(입학처, 2026-04-30)",
        "url": "http://goerica.hanyang.ac.kr/upload/BBS0004/20260430094412DRG9V3.PDF"
      },
      "status": "confirmed"
    },
    {
      "value": "학종 면접형 60→102명 확대, 교과 지역균형 531→380명 축소",
      "source": {
        "name": "한양대 ERICA 2028학년도 신입학 전형계획 주요사항(입학처, 2026-04-30)",
        "url": "http://goerica.hanyang.ac.kr/upload/BBS0004/20260430094412DRG9V3.PDF"
      },
      "status": "confirmed"
    },
    {
      "value": "정시 다군 신설 94명(나군 319→211명)",
      "source": {
        "name": "한양대 ERICA 2028학년도 신입학 전형계획 주요사항(입학처, 2026-04-30)",
        "url": "http://goerica.hanyang.ac.kr/upload/BBS0004/20260430094412DRG9V3.PDF"
      },
      "status": "confirmed"
    }
  ],
  "officialLinks": [
    {
      "name": "한양대 ERICA 입학처",
      "url": "https://goerica.hanyang.ac.kr"
    }
  ]
}
